,Name,urlwebsite,Description
483,Slice,https://slice.club/,Slice is an agency specializing in Facebook and Instagram advertising with strong ROI. Our experts have spent millions of euros on Facebook advertising to avoid costly mistakes.
484,Crisp,https://crisp.chat/fr/,"Discover our customer relationship management platform for startups and SMEs. A unique software for sales, marketing and support: Crisp. 14-day free trial. No credit card required. Try now! We provide a knowledge base, Team Inbox, Chatbot, CRM and many other features to allow you to create your own path to the success of your customers."
485,Metals-Industry,https://metals-industry.com,"Home Metals-Industry.com - For All Know, Buy All and Sell All in One Place and One Single Click - Metals-Industry.com - 1st MarketPlace for the Metal Industry in the World."
486,évolt,https://www.evolt.io,"évolt provides collaborative design tools like brainstorming, user persona, Customer journey map, storyboard, Moodboard, Empathy map and more."
487,Valise,https://voyagesmavalise.com,"Discover new destinations to get away from mass tourism. My Suitcase, a travel account to discover the world differently."
488,chasse,https://www.journeedechasse.com/,Book and offer hunting experiences everywhere in France!
489,Yokitup,https://www.yokitup.com,Yokitup is the complete restaurant management solution that offers you everything you need to drive your business simply and efficiently.
490,JeStockeMonBateau,https://www.jestockemonbateau.fr,"JeStockeMonBateau is the specialist in the storage of boats for individuals and professionals with insurance! The first platform in the world bringing together owners of a garden, shelter, box or garage, with boaters looking for a place to store their boat."
491,DigiReward,https://www.digireward.com,Generate and follow commitment on all points of physical and digital contact with your community... this is our letmotiv.
492,Coudrees,https://www.coudrees.com,
493,Balzeo,https://balzeo.com,"The Balzeo bottle slips into any bag and allows you to enjoy at any time a good hot coffee or a fresh lemonade. At the office, on holiday or in the gym: take it everywhere with you!"
494,OUPSMONTEL,https://www.oupsmontel.fr,Find the best phone repair deals on OUPSMONTEL.fr
495,OtherOffice,https://www.otheroffice.fr,"Specializing in Corporate Real Estate Strategy, OtherOffice is an Independent Consulting Agency in Business Real Estate in Paris and Île-de-France, which brings together all the professions of consulting and transaction at the service of companies."
496,KARMA,https://karma.jobs/,
497,Liebr,https://liebr.io/,"With Liebr, find the best mechanic for your motorcycle / scooter maintenance near you and at the right price!"
498,Naturicious,https://www.naturicious.com/fr/,"Naturicious CBD FRANCE, a French producer. Buy high quality CBD oil, cannabidiol extracts and 100% legal cannabis."
499,Enigmes,https://www.parisenigmes.com,Paris Énigmes is a mobile app for track games in Paris. This app will make you discover the history of France in a fun way.
